<?xml version="1.0" encoding="UTF-8"?>
<?xml-stylesheet type="text/xsl" href="sharing.xsl"?>
<!DOCTYPE photo
[
<!ELEMENT photo (src,description,width,height,size,user)>
<!ELEMENT user (name,email,phone)>
<!ELEMENT src (#PCDATA)>
<!ELEMENT description (#PCDATA)>
<!ELEMENT width (#PCDATA)>
<!ELEMENT height (#PCDATA)>
<!ELEMENT size (#PCDATA)>
<!ELEMENT name (#PCDATA)>
<!ELEMENT email (#PCDATA)>
<!ELEMENT phone (#PCDATA)>
]>

<photo>
     <src>WT Photo sharing project</src>
	 <description>Photo sharing</description>
	 <width>5/03/2018</width>
	 <height>6/03/2018</height>
	 <size>1000kb</size>
     <user>
	   <name>satya</name>
       <email>adurthisatyanarayana@gmail.com</email>
       <phone>9492917922</phone>
     </user>	 
</photo>
